{
  "$schema": "https://mdpresent.dev/schemas/mdpr-development-mode-comparison.schema.json",
  "schemaVersion": "mdpr-development-mode-comparison-v1",
  "generatedBy": "mdpr-skill",
  "sourceReviewedDate": "2026-06-30",
  "comparisonScope": "Actual repository artifacts comparing plain Codex advice, MDPR-only runtime output, and mdpr-skill plus MDPR guided output.",
  "evidenceArtifacts": [
    "artifacts/icon-image-fallback-comparison/simple-codex-skill-output.json",
    "artifacts/icon-image-fallback-comparison/mdpr-build/mdpresent-manifest.json",
    "artifacts/icon-image-fallback-comparison/mdpr-guided-build/mdpresent-manifest.json",
    "artifacts/icon-image-fallback-comparison/mdpr-skill-agent-hint.json",
    "artifacts/icon-image-fallback-comparison/mdpr-skill-change-request.json",
    "artifacts/mdpr-vs-skill/mdpr-vs-skill-report.json",
    "artifacts/llm-before-after/llm_before_after_report.json"
  ],
  "modes": [
    {
      "id": "simple-codex-skill",
      "label": "Simple Codex skill",
      "before": "Can notice that a large or ambiguous icon may need image generation, but produces unstructured prose advice.",
      "after": "Still useful for human review, but not an MDPR-consumable or replayable runtime contract unless translated into a schema-valid bridge artifact.",
      "mdprConsumable": false,
      "deterministicReplayable": false,
      "actualMdprCorpus": {
        "slides": 0,
        "shapes": 0,
        "textFrames": 0,
        "tables": 0,
        "charts": 0
      },
      "evidence": [
        "artifacts/icon-image-fallback-comparison/simple-codex-skill-output.json"
      ]
    },
    {
      "id": "mdpr-only",
      "label": "MDPR only",
      "before": "Builds deterministic PPTX output directly from Markdown and remains the source of truth for parsing, splitting, layout, theme, assets, and validation.",
      "after": "When no hints are supplied, the icon fallback case records agentHints.enabled=false and accepted=0; the broader actual run produces a 46-slide MDPR corpus deck.",
      "mdprConsumable": true,
      "deterministicReplayable": true,
      "actualMdprCorpus": {
        "slides": 46,
        "shapes": 816,
        "textFrames": 648,
        "pictures": 165,
        "tables": 3,
        "charts": 0,
        "minFontSizePt": 10.5
      },
      "guidedHintAcceptance": {
        "enabled": false,
        "accepted": 0,
        "rejected": 0,
        "ignoredBecauseStale": 0,
        "forbiddenFieldCount": 0
      },
      "evidence": [
        "artifacts/icon-image-fallback-comparison/mdpr-build/mdpresent-manifest.json",
        "artifacts/mdpr-vs-skill/mdpr-vs-skill-report.json"
      ]
    },
    {
      "id": "mdpr-skill-plus-mdpr",
      "label": "mdpr-skill + MDPR",
      "before": "Earlier mdpr-skill output for the selected icon context emitted a general hint without a generated-image fallback signal.",
      "after": "Emits schema-valid generated-image candidates, rejects stale source contexts, wraps proposals in approval-bound change requests, and feeds MDPR without taking over final rendering decisions.",
      "mdprConsumable": true,
      "deterministicReplayable": true,
      "actualMdprCorpus": {
        "slides": 10,
        "shapes": 321,
        "textFrames": 318,
        "pictures": 0,
        "tables": 2,
        "charts": 1,
        "minFontSizePt": 8.0
      },
      "guidedHintAcceptance": {
        "enabled": true,
        "accepted": 1,
        "rejected": 0,
        "ignoredBecauseStale": 0,
        "forbiddenFieldCount": 0
      },
      "evidence": [
        "artifacts/icon-image-fallback-comparison/mdpr-guided-build/mdpresent-manifest.json",
        "artifacts/icon-image-fallback-comparison/mdpr-skill-agent-hint.json",
        "artifacts/icon-image-fallback-comparison/mdpr-skill-change-request.json",
        "artifacts/mdpr-vs-skill/mdpr-vs-skill-report.json",
        "artifacts/llm-before-after/llm_before_after_report.json"
      ]
    }
  ],
  "summary": {
    "readmeSignals": [
      "46-slide MDPR corpus",
      "10-slide mdpr-skill evidence deck",
      "schema-valid generated-image candidate",
      "accepted=1 guided hint"
    ],
    "recommendation": "Use MDPR directly for deterministic Markdown-to-PPTX output; add mdpr-skill when development needs replayable semantic hints, source guards, approval-bound proposals, and review evidence."
  }
}
